{
  "API_NAME": "BNGICC",
  "API_DISPLAY_NAME": "BNG New INT API test",
  "API_VERSION": "v1.0",
  "BASE_BACKEND_URL": "https://tstbngwebfa1402.azurewebsites.net/api/v1/allocation/base",
  "BACKEND_SCOPEID_KEYNAME": "bngicc-backend-scopeid",
  "FRONTEND_CLIENTID_KEYNAME": "bngicc-frontend-clientid",
  "TENANT_ID": "#{{ defraTenantId }}",
  "RATE_LIMIT_CALLS": 120,
  "RATE_LIMIT_PERIOD": 60,
  "DEV_BACKEND_URL": "https://tstbngwebfa1402.azurewebsites.net/api/v1/allocation",
  "TST_BACKEND_URL": "https://tstbngwebfa1402.azurewebsites.net/api/v1/allocation/tst",
  "PRE_BACKEND_URL": "https://tstbngwebfa1402.azurewebsites.net/api/v1/allocation/pre"
}
